{
  "schemaVersion": "1.0.0",
  "oracleRecordId": "s5-allocation.clean",
  "provenance": {
    "generatorId": "scorer/oracle/build-oracle.mjs",
    "generatorVersion": "1.0.0",
    "generatedAt": "2026-08-01T00:00:00Z",
    "sourceHash": "sha256:92725807b0e08a73a264af5e0f3025aa78930bea038589162383deaf3444db53"
  },
  "survey": {
    "surveyId": "s5-allocation",
    "title": "Treatment Mix in Moderate-to-Severe Plaque Psoriasis: An Allocation Study",
    "variant": {
      "variantId": "s5-allocation.clean",
      "kind": "clean"
    },
    "document": {
      "documentId": "s5-allocation/questionnaire.docx",
      "contentHash": "sha256:180c15562776e337ae7bb019522f1ff631996f36159f6cd853f72f042e7c1a9b"
    },
    "targetBuild": {
      "buildId": "s5-allocation/index.html",
      "contentHash": "sha256:f47a24afe326ef26f3e57aed9c2279754e8bc267e526aaed001f59ed4d44ffb2"
    }
  },
  "obligations": [
    {
      "oracleId": "s5-allocation/question:Q1",
      "category": "question",
      "type": "question",
      "sourceAnchor": {
        "locator": "Q1",
        "quote": "Thinking about all of your moderate-to-severe plaque psoriasis patients, what percentage is currently managed primarily with each of the following approaches?"
      },
      "requirement": "Q1. Thinking about all of your moderate-to-severe plaque psoriasis patients, what percentage is currently managed primarily with each of the following approaches?",
      "contentHash": "sha256:3d9d281d75c7ea2758b5a8355180709b0be4a2ce6b3aed7f8afada54335a6966",
      "preconditions": [],
      "stimulus": "Reach question Q1",
      "expectedObservables": [
        "Question Q1 is displayed with text: \"Thinking about all of your moderate-to-severe plaque psoriasis patients, what percentage is currently managed primarily with each of the following approaches?\"",
        "Answer input is of type allocation",
        "Allocation row r1: \"Topical therapy alone\"",
        "Allocation row r2: \"Phototherapy\"",
        "Allocation row r3: \"Oral systemic agents\"",
        "Allocation row r4: \"Biologic therapy\"",
        "Allocation row r5: \"Other approaches\""
      ],
      "reachability": {
        "status": "reachable",
        "basis": "exhaustive-walk",
        "witnessPathIds": [
          "p001",
          "p002"
        ]
      }
    },
    {
      "oracleId": "s5-allocation/question:Q2",
      "category": "question",
      "type": "question",
      "sourceAnchor": {
        "locator": "Q2",
        "quote": "You indicated that half or more of your patients receive an oral systemic or biologic therapy. Which factor has been most important in expanding your use of advanced therapies?"
      },
      "requirement": "Q2. You indicated that half or more of your patients receive an oral systemic or biologic therapy. Which factor has been most important in expanding your use of advanced therapies?",
      "contentHash": "sha256:84d7acb9436e4b3921add4c33d533db26cd88501290ec89f85bef815848e7530",
      "preconditions": [],
      "stimulus": "Reach question Q2",
      "expectedObservables": [
        "Question Q2 is displayed with text: \"You indicated that half or more of your patients receive an oral systemic or biologic therapy. Which factor has been most important in expanding your use of advanced therapies?\"",
        "Answer input is of type radio",
        "Option 1: \"Stronger efficacy data\"",
        "Option 2: \"Improved long-term safety evidence\"",
        "Option 3: \"Better insurance coverage\"",
        "Option 4: \"Patient demand\"",
        "Option 5: \"Guideline changes\""
      ],
      "reachability": {
        "status": "reachable",
        "basis": "exhaustive-walk",
        "witnessPathIds": [
          "p001"
        ]
      }
    },
    {
      "oracleId": "s5-allocation/question:Q3",
      "category": "question",
      "type": "question",
      "sourceAnchor": {
        "locator": "Q3",
        "quote": "What is the single biggest barrier to moving more of your patients to advanced therapies?"
      },
      "requirement": "Q3. What is the single biggest barrier to moving more of your patients to advanced therapies?",
      "contentHash": "sha256:191bb6460f0afa83129d6ae44f62eb85421b22c5ba62bb8dd867c05c82d25868",
      "preconditions": [],
      "stimulus": "Reach question Q3",
      "expectedObservables": [
        "Question Q3 is displayed with text: \"What is the single biggest barrier to moving more of your patients to advanced therapies?\"",
        "Answer input is of type radio",
        "Option 1: \"Insurance / prior authorization requirements\"",
        "Option 2: \"Out-of-pocket cost to patients\"",
        "Option 3: \"Safety or monitoring concerns\"",
        "Option 4: \"Patient preference for topical or non-drug approaches\"",
        "Option 5: \"Other\""
      ],
      "reachability": {
        "status": "reachable",
        "basis": "exhaustive-walk",
        "witnessPathIds": [
          "p001",
          "p002"
        ]
      }
    },
    {
      "oracleId": "s5-allocation/question:Q4",
      "category": "question",
      "type": "question",
      "sourceAnchor": {
        "locator": "Q4",
        "quote": "Which biologic class do you consider first for a biologic-naive patient with moderate-to-severe plaque psoriasis?"
      },
      "requirement": "Q4. Which biologic class do you consider first for a biologic-naive patient with moderate-to-severe plaque psoriasis?",
      "contentHash": "sha256:b1dafc8600ed8af54cb43c7158cc4b36be440ae1ca8f1a9fc0b76ec4c37f2df6",
      "preconditions": [],
      "stimulus": "Reach question Q4",
      "expectedObservables": [
        "Question Q4 is displayed with text: \"Which biologic class do you consider first for a biologic-naive patient with moderate-to-severe plaque psoriasis?\"",
        "Answer input is of type radio",
        "Option 1: \"IL-23 inhibitor\"",
        "Option 2: \"IL-17 inhibitor\"",
        "Option 3: \"TNF inhibitor\"",
        "Option 4: \"IL-12/23 inhibitor\"",
        "Option 5: \"No consistent class preference\""
      ],
      "reachability": {
        "status": "reachable",
        "basis": "exhaustive-walk",
        "witnessPathIds": [
          "p001",
          "p002"
        ]
      }
    },
    {
      "oracleId": "s5-allocation/question:Q5",
      "category": "question",
      "type": "question",
      "sourceAnchor": {
        "locator": "Q5",
        "quote": "Of your patients on biologic therapy, approximately what percentage achieve clear or almost-clear skin within 6 months?"
      },
      "requirement": "Q5. Of your patients on biologic therapy, approximately what percentage achieve clear or almost-clear skin within 6 months?",
      "contentHash": "sha256:0e156e4fed2c33f5ba093714e9b39fd04e4aead8313add990562937f85a44544",
      "preconditions": [],
      "stimulus": "Reach question Q5",
      "expectedObservables": [
        "Question Q5 is displayed with text: \"Of your patients on biologic therapy, approximately what percentage achieve clear or almost-clear skin within 6 months?\"",
        "Answer input is of type number"
      ],
      "reachability": {
        "status": "reachable",
        "basis": "exhaustive-walk",
        "witnessPathIds": [
          "p001",
          "p002"
        ]
      }
    },
    {
      "oracleId": "s5-allocation/question:Q6",
      "category": "question",
      "type": "question",
      "sourceAnchor": {
        "locator": "Q6",
        "quote": "What single change would most increase your use of biologic therapy in moderate-to-severe plaque psoriasis?"
      },
      "requirement": "Q6. What single change would most increase your use of biologic therapy in moderate-to-severe plaque psoriasis?",
      "contentHash": "sha256:8ef60e0d365e9540211c40de382cfaddf986388204a479592bceb8799d01b304",
      "preconditions": [],
      "stimulus": "Reach question Q6",
      "expectedObservables": [
        "Question Q6 is displayed with text: \"What single change would most increase your use of biologic therapy in moderate-to-severe plaque psoriasis?\"",
        "Answer input is of type text"
      ],
      "reachability": {
        "status": "reachable",
        "basis": "exhaustive-walk",
        "witnessPathIds": [
          "p001",
          "p002"
        ]
      }
    },
    {
      "oracleId": "s5-allocation/question:Q7",
      "category": "question",
      "type": "question",
      "sourceAnchor": {
        "locator": "Q7",
        "quote": "How likely are you to recommend advanced therapy to a colleague treating moderate-to-severe plaque psoriasis?"
      },
      "requirement": "Q7. How likely are you to recommend advanced therapy to a colleague treating moderate-to-severe plaque psoriasis?",
      "contentHash": "sha256:fc58a4e88241f75e8b013d8403ccb7d081f5d94e7241bab9b4d0a15541bea17d",
      "preconditions": [],
      "stimulus": "Reach question Q7",
      "expectedObservables": [
        "Question Q7 is displayed with text: \"How likely are you to recommend advanced therapy to a colleague treating moderate-to-severe plaque psoriasis?\"",
        "Answer input is of type rating"
      ],
      "reachability": {
        "status": "reachable",
        "basis": "exhaustive-walk",
        "witnessPathIds": [
          "p001",
          "p002"
        ]
      }
    },
    {
      "oracleId": "s5-allocation/question:S1",
      "category": "question",
      "type": "question",
      "sourceAnchor": {
        "locator": "S1",
        "quote": "Which of the following best describes your primary professional role?"
      },
      "requirement": "S1. Which of the following best describes your primary professional role?",
      "contentHash": "sha256:3a53b30da56e83855695eb6fbb49e3df52fab0e562d37a0f2f5e66cd3c5aa51d",
      "preconditions": [],
      "stimulus": "Reach question S1",
      "expectedObservables": [